{
  "schema_version": 2,
  "mode": "demo",
  "issued_at": "2026-09-18T09:00:00+00:00",
  "generated_at": "2026-09-18T09:00:00+00:00",
  "timezone": "Europe/London",
  "region": "G",
  "unit": "p/kWh including VAT",
  "horizon_hours": 168,
  "horizon_end": "2026-09-25T09:00:00+00:00",
  "model": {
    "name": "Simple linear baseline",
    "id": "0b70b4dea378",
    "recipe_id": "linear-ridge-v1",
    "trained_as_of": "2026-09-18T09:00:00+00:00",
    "training_rows": 5778
  },
  "sources": [
    {
      "name": "Example Octopus prices"
    },
    {
      "name": "Example demand forecast"
    },
    {
      "name": "Example wind and solar forecast"
    }
  ],
  "notes": [
    "Made-up demonstration data for 18\u201325 September 2026. These are not actual prices or measured forecasting accuracy."
  ],
  "accuracy": null,
  "calibration": null,
  "slots": [
    {
      "start": "2026-09-17T23:00:00+00:00",
      "end": "2026-09-17T23:30:00+00:00",
      "day": "2026-09-18",
      "minute": 0,
      "clock": "00:00 BST",
      "utc_offset_minutes": 60,
      "price": 13.443,
      "status": "published",
      "policy": "published"
    },
    {
      "start": "2026-09-17T23:30:00+00:00",
      "end": "2026-09-18T00:00:00+00:00",
      "day": "2026-09-18",
      "minute": 30,
      "clock": "00:30 BST",
      "utc_offset_minutes": 60,
      "price": 13.926,
      "status": "published",
      "policy": "published"
    },
    {
      "start": "2026-09-18T00:00:00+00:00",
      "end": "2026-09-18T00:30:00+00:00",
      "day": "2026-09-18",
      "minute": 60,
      "clock": "01:00 BST",
      "utc_offset_minutes": 60,
      "price": 12.454,
      "status": "published",
      "policy": "published"
    },
    {
      "start": "2026-09-18T00:30:00+00:00",
      "end": "2026-09-18T01:00:00+00:00",
      "day": "2026-09-18",
      "minute": 90,
      "clock": "01:30 BST",
      "utc_offset_minutes": 60,
      "price": 14.073,
      "status": "published",
      "policy": "published"
    },
    {
      "start": "2026-09-18T01:00:00+00:00",
      "end": "2026-09-18T01:30:00+00:00",
      "day": "2026-09-18",
      "minute": 120,
      "clock": "02:00 BST",
      "utc_offset_minutes": 60,
      "price": 13.95,
      "status": "published",
      "policy": "published"
    },
    {
      "start": "2026-09-18T01:30:00+00:00",
      "end": "2026-09-18T02:00:00+00:00",
      "day": "2026-09-18",
      "minute": 150,
      "clock": "02:30 BST",
      "utc_offset_minutes": 60,
      "price": 12.653,
      "status": "published",
      "policy": "published"
    },
    {
      "start": "2026-09-18T02:00:00+00:00",
      "end": "2026-09-18T02:30:00+00:00",
      "day": "2026-09-18",
      "minute": 180,
      "clock": "03:00 BST",
      "utc_offset_minutes": 60,
      "price": 13.593,
      "status": "published",
      "policy": "published"
    },
    {
      "start": "2026-09-18T02:30:00+00:00",
      "end": "2026-09-18T03:00:00+00:00",
      "day": "2026-09-18",
      "minute": 210,
      "clock": "03:30 BST",
      "utc_offset_minutes": 60,
      "price": 13.552,
      "status": "published",
      "policy": "published"
    },
    {
      "start": "2026-09-18T03:00:00+00:00",
      "end": "2026-09-18T03:30:00+00:00",
      "day": "2026-09-18",
      "minute": 240,
      "clock": "04:00 BST",
      "utc_offset_minutes": 60,
      "price": 12.944,
      "status": "published",
      "policy": "published"
    },
    {
      "start": "2026-09-18T03:30:00+00:00",
      "end": "2026-09-18T04:00:00+00:00",
      "day": "2026-09-18",
      "minute": 270,
      "clock": "04:30 BST",
      "utc_offset_minutes": 60,
      "price": 15.605,
      "status": "published",
      "policy": "published"
    },
    {
      "start": "2026-09-18T04:00:00+00:00",
      "end": "2026-09-18T04:30:00+00:00",
      "day": "2026-09-18",
      "minute": 300,
      "clock": "05:00 BST",
      "utc_offset_minutes": 60,
      "price": 15.16,
      "status": "published",
      "policy": "published"
    },
    {
      "start": "2026-09-18T04:30:00+00:00",
      "end": "2026-09-18T05:00:00+00:00",
      "day": "2026-09-18",
      "minute": 330,
      "clock": "05:30 BST",
      "utc_offset_minutes": 60,
      "price": 13.841,
      "status": "published",
      "policy": "published"
    },
    {
      "start": "2026-09-18T05:00:00+00:00",
      "end": "2026-09-18T05:30:00+00:00",
      "day": "2026-09-18",
      "minute": 360,
      "clock": "06:00 BST",
      "utc_offset_minutes": 60,
      "price": 16.4,
      "status": "published",
      "policy": "published"
    },
    {
      "start": "2026-09-18T05:30:00+00:00",
      "end": "2026-09-18T06:00:00+00:00",
      "day": "2026-09-18",
      "minute": 390,
      "clock": "06:30 BST",
      "utc_offset_minutes": 60,
      "price": 14.111,
      "status": "published",
      "policy": "published"
    },
    {
      "start": "2026-09-18T06:00:00+00:00",
      "end": "2026-09-18T06:30:00+00:00",
      "day": "2026-09-18",
      "minute": 420,
      "clock": "07:00 BST",
      "utc_offset_minutes": 60,
      "price": 15.408,
      "status": "published",
      "policy": "published"
    },
    {
      "start": "2026-09-18T06:30:00+00:00",
      "end": "2026-09-18T07:00:00+00:00",
      "day": "2026-09-18",
      "minute": 450,
      "clock": "07:30 BST",
      "utc_offset_minutes": 60,
      "price": 13.531,
      "status": "published",
      "policy": "published"
    },
    {
      "start": "2026-09-18T07:00:00+00:00",
      "end": "2026-09-18T07:30:00+00:00",
      "day": "2026-09-18",
      "minute": 480,
      "clock": "08:00 BST",
      "utc_offset_minutes": 60,
      "price": 15.244,
      "status": "published",
      "policy": "published"
    },
    {
      "start": "2026-09-18T07:30:00+00:00",
      "end": "2026-09-18T08:00:00+00:00",
      "day": "2026-09-18",
      "minute": 510,
      "clock": "08:30 BST",
      "utc_offset_minutes": 60,
      "price": 15.015,
      "status": "published",
      "policy": "published"
    },
    {
      "start": "2026-09-18T08:00:00+00:00",
      "end": "2026-09-18T08:30:00+00:00",
      "day": "2026-09-18",
      "minute": 540,
      "clock": "09:00 BST",
      "utc_offset_minutes": 60,
      "price": 16.082,
      "status": "published",
      "policy": "published"
    },
    {
      "start": "2026-09-18T08:30:00+00:00",
      "end": "2026-09-18T09:00:00+00:00",
      "day": "2026-09-18",
      "minute": 570,
      "clock": "09:30 BST",
      "utc_offset_minutes": 60,
      "price": 13.877,
      "status": "published",
      "policy": "published"
    },
    {
      "start": "2026-09-18T09:00:00+00:00",
      "end": "2026-09-18T09:30:00+00:00",
      "day": "2026-09-18",
      "minute": 600,
      "clock": "10:00 BST",
      "utc_offset_minutes": 60,
      "price": 15.454,
      "status": "published",
      "policy": "published"
    },
    {
      "start": "2026-09-18T09:30:00+00:00",
      "end": "2026-09-18T10:00:00+00:00",
      "day": "2026-09-18",
      "minute": 630,
      "clock": "10:30 BST",
      "utc_offset_minutes": 60,
      "price": 15.04,
      "status": "published",
      "policy": "published"
    },
    {
      "start": "2026-09-18T10:00:00+00:00",
      "end": "2026-09-18T10:30:00+00:00",
      "day": "2026-09-18",
      "minute": 660,
      "clock": "11:00 BST",
      "utc_offset_minutes": 60,
      "price": 13.953,
      "status": "published",
      "policy": "published"
    },
    {
      "start": "2026-09-18T10:30:00+00:00",
      "end": "2026-09-18T11:00:00+00:00",
      "day": "2026-09-18",
      "minute": 690,
      "clock": "11:30 BST",
      "utc_offset_minutes": 60,
      "price": 16.518,
      "status": "published",
      "policy": "published"
    },
    {
      "start": "2026-09-18T11:00:00+00:00",
      "end": "2026-09-18T11:30:00+00:00",
      "day": "2026-09-18",
      "minute": 720,
      "clock": "12:00 BST",
      "utc_offset_minutes": 60,
      "price": 16.778,
      "status": "published",
      "policy": "published"
    },
    {
      "start": "2026-09-18T11:30:00+00:00",
      "end": "2026-09-18T12:00:00+00:00",
      "day": "2026-09-18",
      "minute": 750,
      "clock": "12:30 BST",
      "utc_offset_minutes": 60,
      "price": 14.158,
      "status": "published",
      "policy": "published"
    },
    {
      "start": "2026-09-18T12:00:00+00:00",
      "end": "2026-09-18T12:30:00+00:00",
      "day": "2026-09-18",
      "minute": 780,
      "clock": "13:00 BST",
      "utc_offset_minutes": 60,
      "price": 13.64,
      "status": "published",
      "policy": "published"
    },
    {
      "start": "2026-09-18T12:30:00+00:00",
      "end": "2026-09-18T13:00:00+00:00",
      "day": "2026-09-18",
      "minute": 810,
      "clock": "13:30 BST",
      "utc_offset_minutes": 60,
      "price": 15.334,
      "status": "published",
      "policy": "published"
    },
    {
      "start": "2026-09-18T13:00:00+00:00",
      "end": "2026-09-18T13:30:00+00:00",
      "day": "2026-09-18",
      "minute": 840,
      "clock": "14:00 BST",
      "utc_offset_minutes": 60,
      "price": 15.502,
      "status": "published",
      "policy": "published"
    },
    {
      "start": "2026-09-18T13:30:00+00:00",
      "end": "2026-09-18T14:00:00+00:00",
      "day": "2026-09-18",
      "minute": 870,
      "clock": "14:30 BST",
      "utc_offset_minutes": 60,
      "price": 14.738,
      "status": "published",
      "policy": "published"
    },
    {
      "start": "2026-09-18T14:00:00+00:00",
      "end": "2026-09-18T14:30:00+00:00",
      "day": "2026-09-18",
      "minute": 900,
      "clock": "15:00 BST",
      "utc_offset_minutes": 60,
      "price": 13.091,
      "status": "published",
      "policy": "published"
    },
    {
      "start": "2026-09-18T14:30:00+00:00",
      "end": "2026-09-18T15:00:00+00:00",
      "day": "2026-09-18",
      "minute": 930,
      "clock": "15:30 BST",
      "utc_offset_minutes": 60,
      "price": 16.214,